Name,Full Address,Street,City,Postcode,State,Country,Amenity,Healthcare,Phone,Website,Opening Hours,Latitude,Longitude
Dr Zakir Hussain Hospital,"Mumbai-Agra national Highway, Opp. SBI, Kathda, Nashik",Unknown,Unknown,422001,Maharashtra,Unknown,hospital,Unknown,Unknown,Unknown,Unknown,19.996035,73.799109
Dr Aware Hospital,Unknown,Unknown,Unknown,Unknown,Unknown,Unknown,hospital,Unknown,Unknown,Unknown,Unknown,19.9826086,73.7774614
Nahush Eye Hospital,Unknown,Unknown,Unknown,Unknown,Unknown,Unknown,hospital,Unknown,Unknown,Unknown,Unknown,19.9827112,73.7776885
Dr Bapaye Hospital,"Behind N D C C Bank, Old Agra Road, Old Agra Road",Unknown,Unknown,422001,Maharashtra,Unknown,hospital,Unknown,Unknown,Unknown,Unknown,19.9990223,73.7826899
Unknown,Unknown,Unknown,Unknown,Unknown,Unknown,Unknown,hospital,Unknown,Unknown,Unknown,Unknown,19.984407,73.776653
Unknown,Unknown,Unknown,Unknown,Unknown,Unknown,Unknown,hospital,Unknown,Unknown,Unknown,Unknown,19.9962269,73.7791902
Dr.Paner Surgical Hospital,Unknown,Trimurti-Kamatwade Road,Nashik,422008,Unknown,Unknown,hospital,hospital,+91 9823095425,Unknown,Unknown,19.9827257,73.755308
Dr. Suryawanshi Eye Hospital,"Near Hotel Sandeep, Mumbai Naka,Kute Marg",Unknown,Unknown,422002,Maharashtra,Unknown,hospital,Unknown,Unknown,Unknown,Unknown,19.9908377,73.779341
"Sarthak Hospital, Nashik","3Road & 4Rt Floor, Susya Arcade, Opposite Nilmani Bus Stand, Panchvati",Unknown,Unknown,422003,Maharashtra,Unknown,hospital,Unknown,Unknown,Unknown,Unknown,19.9886951,73.7221402
"Aashirwad Hospital, Nashik","Vasant Vyakhyanmala Maidan, Behind Durga Mata Mandir, Trimurti Chowk",Unknown,Unknown,422008,Maharashtra,Unknown,hospital,Unknown,Unknown,Unknown,Unknown,19.9841655,73.7560272
"Arihant Hospital, Nashik","Behind Wasan Showroom, Mumbai Naka",Unknown,Unknown,422001,Maharashtra,Unknown,hospital,Unknown,Unknown,Unknown,Unknown,19.9885866,73.7846356
Vakratunda Multispeciality Hospital - Nasik,"1st Floor, Rhaghukul Sankul,Behind Hotel Bandhuraj,Pathardi Phatta",Unknown,Unknown,422010,Maharashtra,Unknown,hospital,Unknown,Unknown,Unknown,Unknown,19.9551579,73.7575868
"Vasan Eye Care Hospital, Nasik","Bhabha Nagar, Corner Mubai Naka, Nashik, Maharastra Nashik",Unknown,Unknown,422001,Maharashtra,Unknown,hospital,Unknown,Unknown,Unknown,Unknown,19.9869925,73.7852164
"Dr A.K.Pawar Institute of Obstetrics, Gynecology and Reproductive Medicine","Charuhas, Near Gaikwad Classes, Kanherewad",Unknown,Unknown,422001,Maharashtra,Unknown,hospital,Unknown,Unknown,Unknown,Unknown,19.9996923,73.7833911
Swadi Hospital,"960/5, Wadner Road, Deolali Camp",Unknown,Unknown,422401,Maharashtra,Unknown,hospital,Unknown,Unknown,Unknown,Unknown,19.9033228,73.8308689
Shreeya Hospital,"Gayakwad Nagar, Mumbai Naka, Near Mahamarg Bus Stand",Unknown,Unknown,422002,Maharashtra,Unknown,hospital,Unknown,Unknown,Unknown,Unknown,19.987973,73.7822418
"Muktai Hospital, Jalgaon","Shivaji Nagar, Jammer.Tal.Jamner",Unknown,Unknown,424206,Maharashtra,Unknown,hospital,Unknown,Unknown,Unknown,Unknown,19.9778567,73.8106236
Dr. Karad Hospital,"Satpur,Nashik-Trimbak Road",Unknown,Unknown,422007,Maharashtra,Unknown,hospital,Unknown,Unknown,Unknown,Unknown,19.9903392,73.7356223
Suvichar Hospital Pvt. Ltd,"858 / 85, Ganesh Bada Nagar, Behind Hotel Siddharth, Poona Road",Unknown,Unknown,422001,Maharashtra,Unknown,hospital,Unknown,Unknown,Unknown,Unknown,19.9826909,73.8026011
Indorewala ENT Hospital,"Behind Mahamarg Bus Stand, Old Mumbai- Naka, Gaikwad Nagar",Unknown,Unknown,422001,Maharashtra,Unknown,hospital,Unknown,Unknown,Unknown,Unknown,19.9858163,73.7818252
Sudarshan Hospital,"City Plaza, Opp Kalika Mandir, Old Agra Road",Unknown,Unknown,422002,Maharashtra,Unknown,hospital,Unknown,Unknown,Unknown,Unknown,19.9921727,73.7835663
Shrinivas Multispeciality Hospital,N-35/S-4/8/1 Swami Vivekand Nagar State Bank Chowk Mumbai-Agra Highway Cidco,Unknown,Unknown,422008,Maharashtra,Unknown,hospital,Unknown,Unknown,Unknown,Unknown,19.9675714,73.7684003
Dr Ganorkar Hospital,Behind Mahamarg Bus Stand Mumbai Naka,Unknown,Unknown,422001,Maharashtra,Unknown,hospital,Unknown,Unknown,Unknown,Unknown,19.9880209,73.7818341
Nasik Health Care and Research Centre Pvt.Ltd,"Dr Bhabha Nagar,Kaut Ghat Road,New Mumbai -Agra Road",Unknown,Unknown,422011,Maharashtra,Unknown,hospital,Unknown,Unknown,Unknown,Unknown,19.9884752,73.7899759
Shree Saibaba Heart Insititue and Research Center Pvt. Ltd.,"Near Kalidar Kala Mandir,Shalimar",Unknown,Unknown,422002,Maharashtra,Unknown,hospital,Unknown,Unknown,Unknown,Unknown,19.9999141,73.7841488
Birla Super Speciality Eye Hospital and Lasik Centre,"B-180, Opposite Zilla Parishad, Trimbak Road",Unknown,Unknown,422002,Maharashtra,Unknown,hospital,Unknown,02532505666,https://birlaeyehospital.com/,Unknown,19.9978876,73.7832248
Barde Maternity Hospital,"Vedashree Lane No-1, Suchita , Behind Hotel Inayat Cafe,Mumbai Agra Road",Unknown,Unknown,422009,Maharashtra,Unknown,hospital,Unknown,Unknown,Unknown,Unknown,19.9802987,73.7820715
Sukhakarta Hospital,"ITI-Ambad Link Road, Near CITU Bhavan, Khutwad Nagar",Unknown,Unknown,422008,Maharashtra,Unknown,hospital,Unknown,Unknown,https://sukhakartahospital.in/,Unknown,19.9850043,73.749032
"Usha Hospital, Nashik","Plot, No 14, Sunderban Colony, Lekhanagar, Cidco",Unknown,Unknown,422009,Maharashtra,Unknown,hospital,Unknown,Unknown,Unknown,Unknown,19.9781346,73.7773159
Shinge Superspeciality Hospital,"Opposite Rachana Vidyalalya,Kilkarni Colony,Sharanpur Road",Unknown,Unknown,422002,Maharashtra,Unknown,hospital,Unknown,Unknown,Unknown,Unknown,19.9984105,73.7711187
Kute Eye Hospital,"S.N. Kute Marg,Tidke Colony",Unknown,Unknown,422002,Maharashtra,Unknown,hospital,Unknown,Unknown,Unknown,Unknown,19.9917136,73.7790366
Maher Hospital,"No. 54, Lahuti Nagar, Behind Moule Hall, Trimbak Road . Satpur",Unknown,Unknown,422007,Maharashtra,Unknown,hospital,Unknown,Unknown,Unknown,Unknown,19.986719,73.7210767
City Care Hospital and Research Centre Pvt. Ltd,"Near Nasardi Bridge, Nasik-Poona Road, Dwarka",Unknown,Unknown,422001,Maharashtra,Unknown,hospital,Unknown,Unknown,Unknown,Unknown,19.9875917,73.8016657
Chirayu Childrens Hospital,"Samadhan Sankul-1st Floor, Beside St Philip Church, Nashik Road",Unknown,Unknown,422101,Maharashtra,Unknown,hospital,Unknown,Unknown,Unknown,Unknown,19.9528704,73.835717
Dr.Pimprikar Hspital,"Govind Nagar, Chowk No.5,Behind Hotel Prakesh,Mumbai Naka",Unknown,Unknown,422002,Maharashtra,Unknown,hospital,Unknown,Unknown,Unknown,Unknown,19.9845008,73.7766977
Dr Paprikar Maternity and Nursing Home,"Gaikwad Mala, Behind Regimental Plaza, Nashik Road",Unknown,Unknown,422101,Maharashtra,Unknown,clinic,Unknown,Unknown,Unknown,Unknown,19.9531162,73.8364097
Sahyadri Speciality Hospital,"Mumbai Agra Road, Near Dwarka Circle, Wadala Road",Unknown,Unknown,422001,Maharashtra,Unknown,hospital,Unknown,Unknown,Unknown,Unknown,19.98929,73.7935165
Tulasi Eye Hospital,"Happy Home Colony,Near General Vaitya Nagar,Pune Road",Unknown,Unknown,422011,Maharashtra,Unknown,hospital,Unknown,Unknown,Unknown,Unknown,19.9863157,73.798559
Wockhardt Hospitals,Wadala Naka Mumbai Agra Road,Unknown,Unknown,422001,Maharashtra,Unknown,hospital,Unknown,Unknown,Unknown,Unknown,19.9917451,73.7904131
Suyash Hospital,"No. 594 / 3, Ahilyabai Holkar Marg, Near Mahamarg Bus Stand, Mumbai Naka, Tidke Colony",Unknown,Unknown,422003,Maharashtra,Unknown,hospital,Unknown,Unknown,Unknown,Unknown,19.9890052,73.7797084
Surana Hospital - Nasik Road,"Surana Hospital 1st Floor, Ishwar Sankul-C, Behind Regimental Theatre, Nasik Road",Unknown,Unknown,422008,Maharashtra,Unknown,hospital,Unknown,Unknown,Unknown,Unknown,19.9476728,73.8346964
Jai Hospital Pvt Ltd,Rohit Appartment Shyamlal Gupta Marg,Unknown,NASHIK,422002,Maharashtra,Unknown,hospital,Unknown,Unknown,Unknown,Unknown,19.9973243,73.7740885
Asha Kendra Hospital,"Netaji Subhash Colony, Ramdas Swami Nagar, Behind Gandhinagar",Unknown,Unknown,422006,Maharashtra,Unknown,hospital,Unknown,Unknown,Unknown,Unknown,19.9765314,73.8193629
"Life Care Hospital, Nashik","Lekha Nagar, Saptashringi Complex, Mumbai- Agra Road",Unknown,Unknown,422001,Maharashtra,Unknown,hospital,Unknown,Unknown,Unknown,Unknown,19.9724375,73.7730458
"Trupti Hospital, Nashik","Near Nehete Hospital & Sandeep Hotel, Tidke Colony",Unknown,Unknown,422002,Maharashtra,Unknown,hospital,Unknown,Unknown,Unknown,Unknown,19.9905617,73.7791546
Trimurti Multispeciality Hospital - Nasik,"2nd Floor, Purab-Paschim Plaza, Trimurti Chowk Divya Adlabs, Cidco, New Nashik",Unknown,Unknown,422008,Maharashtra,Unknown,hospital,Unknown,Unknown,Unknown,Unknown,19.9814935,73.7558636
Sanskriti Multi Speciality Hospital,"Shop No-1, Ram Plaza, Nav- Shakti Chowk, New Mumbai-Naka Near Dadasaheb Gaikwad Hall",Unknown,Unknown,422011,Maharashtra,Unknown,hospital,Unknown,Unknown,Unknown,Unknown,19.9878041,73.7899652
"Suman Hospital, Nashik","Shivnery, First Floor, Ner. Rane Nagar Signal, Mumbai, Agra Road",Unknown,Unknown,422009,Maharashtra,Unknown,hospital,Unknown,Unknown,Unknown,Unknown,19.9665045,73.7674903
Karandikar Hospital and Research Centre,"Behind Prakash Petrol Pump, Govind Nagar, Mumbai - Agra Road",Unknown,Unknown,422009,Maharashtra,Unknown,hospital,Unknown,0253 247 2076,http://www.karandikarhospital.com/,Unknown,19.984284,73.7770866
Nirgude Nursing Home,"Model Colony,Shiva Ji Nagar,Nashik Road",Unknown,Unknown,422001,Maharashtra,Unknown,clinic,Unknown,Unknown,Unknown,Unknown,19.9754329,73.8417774
"Surya Nursing Home, Nashik","Gaikwad Mala,Behind Regimental Cinema",Unknown,Unknown,422101,Maharashtra,Unknown,clinic,Unknown,Unknown,Unknown,Unknown,19.9536198,73.8358659
"Shreeji Hospital, Nashik","Castle Rock.Near canada Crnter Signal,Opp Vishwas Bank",MATOSHRI NAGAR.CHURCH ROAD,Nashik,422005,Maharashtra,Unknown,hospital,Unknown,Unknown,Unknown,Unknown,19.9964383,73.7799472
"Chiranjeev Hospital, Nashik",Ashirwad Complex Opp Zilha Parishad Near Trimbak Naka,Unknown,Unknown,422001,Maharashtra,Unknown,hospital,Unknown,Unknown,Unknown,Unknown,19.9888741,73.7800531
Bhaskar Ent Hospital,"Krishnai Sankul, Vakil Wadi",Unknown,Unknown,422001,Maharashtra,Unknown,hospital,Unknown,Unknown,Unknown,Unknown,19.9890228,73.780041
Dr Lads Navjeevan Hospital Pvt Ltd,"S.No-594/2, Plot No -2, Holkar Road, Near Tupsakhre Lawns, Tidke Colony",Unknown,Unknown,422002,Maharashtra,Unknown,hospital,Unknown,Unknown,Unknown,Unknown,19.9888577,73.7794456
Torne Ent Hospital,"Ahilyadevi Holkar Marg, Near Mahanagar Bus Stand,Opposite Suyash Hospital, Mumabi Naka",Unknown,Unknown,422002,Maharashtra,Unknown,hospital,Unknown,Unknown,Unknown,Unknown,19.9895837,73.7797118
Anand Hospital and Nursing Home,"Parab Nasgar, Opposite Datta Mandir, Indira Nagar",Unknown,Unknown,422009,Maharashtra,Unknown,hospital,Unknown,Unknown,Unknown,Unknown,19.972578,73.7866808
Ahura Maternity Hospital,"Shirin Patel Colony, Shivaji Road",Unknown,Unknown,422008,Maharashtra,Unknown,hospital,Unknown,Unknown,Unknown,Unknown,19.9961371,73.7841891
Criticare Hospital For Children,"Citycentre, Opp Sindhi Colony, Jail Road",Unknown,Unknown,422101,Maharashtra,Unknown,hospital,Unknown,Unknown,Unknown,Unknown,19.959247,73.8391764
Ashwini Accident Multi Speciality Hospital,"Chowk No 5,Govind Nagar Gihind Parkash Petrol Pump Mumbai Naka",Unknown,Unknown,422009,Maharashtra,Unknown,hospital,Unknown,Unknown,Unknown,Unknown,19.9870542,73.7774782
Nashikroad Multispeciality Hospital,1st Floor Hotel Shangrilla Opposite Somani Garden,Unknown,Unknown,422101,Maharashtra,Unknown,hospital,Unknown,Unknown,Unknown,Unknown,19.9503819,73.8375691
Dr.Sandip A.Kotwal,Takliphata Dwarka,Unknown,Unknown,422011,Maharashtra,Unknown,clinic,Unknown,Unknown,Unknown,Unknown,19.9952083,73.8025247
New National Hospital,"Kazi Nagar, Opposite Aaiesha Masjid, Wadala Road",Unknown,Unknown,422007,Maharashtra,Unknown,hospital,Unknown,Unknown,Unknown,Unknown,19.9906108,73.7942138
Curie Manavata Cancer Centre,"Opposite Hotel Sandeep, Mumbai Naka, Mahamarg Bus Stand",Unknown,Unknown,422002,Maharashtra,Unknown,hospital,Unknown,Unknown,https://www.hcgmanavatacancer.org/,Unknown,19.9897261,73.7831658
"Janak Hospital, Nashik","Near Sagar Sweets, Rajmata Jijau Marg, Govind Naga",Unknown,Unknown,422001,Maharashtra,Unknown,hospital,Unknown,Unknown,Unknown,Unknown,19.9817588,73.7769464
Vimal Maternity and General Hosp,Doctor House,"Docotor house, oppoiste civil hospital",Nashik,422001,Maharashtra,Unknown,hospital,Unknown,Unknown,Unknown,Unknown,19.9967232,73.7803482
Sahajeevan General Hospital,"9, Telephone Exchange Rd, Ashwin Nagar",Unknown,Unknown,422009,Maharashtra,Unknown,hospital,Unknown,Unknown,Unknown,Unknown,19.9642255,73.7649067
Thakar Hospital,Nashik,Unknown,Unknown,422002,Maharashtra,Unknown,hospital,Unknown,Unknown,Unknown,Unknown,19.9858682,73.7818944
Om Hospital,"Behind Regimental Plaza, Gaikwad Mala Road,Nasik Road",Unknown,Unknown,422101,Maharashtra,Unknown,hospital,Unknown,Unknown,Unknown,Unknown,19.952762,73.8360912
Gujarathi Hospital,Datta Mandir Stop Near Matwani Factor Nasik Road,Unknown,Unknown,422006,Maharashtra,Unknown,hospital,Unknown,Unknown,Unknown,Unknown,19.958432,73.8352811
Vatshalya Maternity Hospital and Infertility Clinic,"Jay Plaza, Pelican Park Rd, Swami Vivekanand Nagar, Shri Ram Colony",Unknown,Unknown,422010,Maharashtra,Unknown,hospital,Unknown,Unknown,Unknown,Unknown,19.9646578,73.7659286
Vishwesh Childrens Hospital,"Behind Suyash Hospital, Mumbai Naka, Tidke Colony",Unknown,Unknown,422001,Maharashtra,Unknown,hospital,Unknown,Unknown,Unknown,Unknown,19.9881343,73.7790459
Cantoment General Hospital,Devlali,Unknown,Unknown,422002,Maharashtra,Unknown,hospital,Unknown,Unknown,Unknown,Unknown,19.9033474,73.8255608
"Shushrusha Hospital, Nashik",Upnagar,Unknown,Unknown,422002,Maharashtra,Unknown,hospital,Unknown,Unknown,Unknown,Unknown,19.9698189,73.8213068
Dhanvantari Hospital,"Tilak Wadi, Near Mayor's Bungalow","opposite city pride histel, tilakwadi",Nashik,422002,Maharashtra,Unknown,hospital,Unknown,Unknown,Unknown,Unknown,19.9984566,73.7767024
Jairam Hospitals and Research Centre Pvt Ltd,"Opp Muktidham, Hospital Road, Near Hotel Vasco",Unknown,Unknown,422101,Maharashtra,Unknown,hospital,Unknown,Unknown,Unknown,Unknown,19.95105,73.8386245
Sujata Birla Hospital and Medical Research Centre,"Opp Bytco College, Nasik Road",Unknown,Unknown,422101,Maharashtra,Unknown,hospital,Unknown,Unknown,Unknown,Unknown,19.959617,73.8310245
Swami Hospital Nasik,"Shree Hari Plaza , Above Hotel Vaibhav, 2nd Floor New Adgaon Naka, Panchvati",Unknown,Unknown,422003,Maharashtra,Unknown,hospital,Unknown,Unknown,Unknown,Unknown,19.9685231,73.7589361
"Primary Health Sub Centre, Sansari","Sansari, Nashik",Unknown,Unknown,Unknown,Maharashtra,Unknown,Unknown,centre,Unknown,Unknown,Unknown,19.9062577,73.8383335
NSKMC JDC Bytco Hospital-(D),"Shastri Path, Near NMC Divisional Office, Nashik",Unknown,Unknown,422214,Maharashtra,Unknown,hospital,Unknown,Unknown,Unknown,Unknown,19.9491303,73.8386246
ESI Hospital Satpur Nashik,"ESI Hospital Satpur Nashik, NEAR DMO OFFICE, Satpur",Unknown,Unknown,422007,Maharashtra,Unknown,hospital,Unknown,Unknown,Unknown,Unknown,19.9918349,73.7338339
"NMCH, Cidco","Sambhaji Stadium Road, Near Overhead Water Tank, Nashik",Unknown,Unknown,422010,Maharashtra,Unknown,hospital,Unknown,Unknown,Unknown,Unknown,19.9654705,73.7622144
NSKMC Panchak Hospital,"Jail Road, Near Panchak School, Nashik",Unknown,Unknown,422214,Maharashtra,Unknown,hospital,Unknown,Unknown,Unknown,Unknown,19.9864534,73.8492727
Samarth General Hospital,"Mumbai Agra Road, Near Ambad Police Station, Cidco, Nashik",Unknown,Unknown,422009,Maharashtra,Unknown,hospital,Unknown,Unknown,Unknown,Unknown,19.9673414,73.7681624
"Civil Hospital, Nashik","Police Staff Colony, Nashik","thakkar bazar,opposite golg club maidan",Nashik,422002,Maharashtra,Unknown,hospital,Unknown,Unknown,Unknown,Unknown,19.996932,73.778263
"UPHC, Upnagar","Sailani Baba Road, Near Indian Postal Service Depot, Nashik",Unknown,Unknown,422214,Maharashtra,Unknown,Unknown,centre,Unknown,Unknown,Unknown,19.9733644,73.8239614
"SubCentre, Palase",Palase,Unknown,Unknown,422101,Maharashtra,Unknown,Unknown,centre,Unknown,Unknown,Unknown,19.929354,73.8675142
Kaivalya Clinic,"Nashik Road, Nashik",Unknown,Unknown,422101,Maharastra,Unknown,clinic,Unknown,Unknown,Unknown,Unknown,19.977303,73.840217
Matoshree Hospital,"Nashik - Pune Road, Near Bytco Hospital, Rajwada Nagar, Deolali Gaon, Nashik",Unknown,Unknown,422101,Maharastra,Unknown,hospital,Unknown,Unknown,Unknown,Unknown,19.9504823,73.8381773
Shree Sankalp Hospital,"Hari Bhakti, Artillery Centre Road, Near Jain Mandir, Nashik",Unknown,Unknown,422101,Maharastra,Unknown,hospital,Unknown,Unknown,Unknown,Unknown,19.9480032,73.834358
Jadhav Hospital,"Anand Nagar, Behind Muktidham, Nashik Road, Nashik",Unknown,Unknown,422101,Maharastra,Unknown,hospital,Unknown,Unknown,Unknown,Unknown,19.9505453,73.8306582
Akshay Hospital,"Gandharva Nagari, Rosa Colony, Sane Guruji Nagar, Nashik",Unknown,Unknown,422214,Maharastra,Unknown,hospital,Unknown,Unknown,Unknown,Unknown,19.961164,73.833422
Venus super Speciality Hospital Limited,"Ambad Satpur Link Road, XLO Point, Ambedkar Nagar, Sanjeev Nagar, Nashik",Unknown,Unknown,422007,Maharastra,Unknown,hospital,Unknown,Unknown,Unknown,Unknown,19.963289,73.734193
Pragati Health Care Hospital,"Arc Heaven Lam Road, Sansari, Naka, Deolali Camp, Nashik",Unknown,Unknown,422401,Maharastra,Unknown,hospital,Unknown,Unknown,Unknown,Unknown,19.9073141,73.8327094
Mogal Hospital,"1st Floor, Kailashdeep, Jail Road, Nashik",Unknown,Unknown,422101,Maharastra,Unknown,hospital,Unknown,Unknown,Unknown,Unknown,19.958211,73.838324
Omkar Hospital,"Hospital Road, Sneh Bandhan Colony, Gayakhe Colony, Nashik Road, Nashi",Unknown,Unknown,422214,Maharastra,Unknown,hospital,Unknown,Unknown,Unknown,Unknown,19.953202,73.836082
Sanjeevani Dental and Accident Hospital,"Deodarshan Apartment, Near G. D. Somani Garden, Deolali Gaon, Nashik",Unknown,Unknown,422101,Maharastra,Unknown,hospital,Unknown,Unknown,Unknown,Unknown,19.950332,73.836886
Dr. Tamboli Hospital,"NTPS Colony, Eklahare",Unknown,Unknown,422105,Maharastra,Unknown,hospital,Unknown,Unknown,Unknown,Unknown,19.9741286,73.8775552
Muthal Hospital,"Hari Niwas, First Floor, Opp NMC Ground, Nashik Road, Nashik",Unknown,Unknown,422101,Maharastra,Unknown,hospital,Unknown,Unknown,Unknown,Unknown,19.951081,73.8325961
Vedant ENT Clinic,"Ground Floor, Gaikwad Mala Road, Behind Om Hospital, Bytco Point, Nashik",Unknown,Unknown,422101,Maharastra,Unknown,clinic,Unknown,Unknown,Unknown,Unknown,19.952831,73.835473
New Life Hospital,"Jail Road, Nashik",Unknown,Unknown,422006,Maharastra,Unknown,hospital,Unknown,Unknown,Unknown,Unknown,19.9762811,73.8417881
Sai Seva Children Hospital,"Trimbak Complex, Shahu Maharaj Path, Opp Bytco Hospital, Nashik",Unknown,Unknown,422002,Maharastra,Unknown,hospital,Unknown,Unknown,Unknown,Unknown,19.9502598,73.8385475
Jeevan Jyoti Hospital,"Canal Road, Gosavi Nagar, Upnagar, Nashik",Unknown,Unknown,422006,Maharastra,Unknown,hospital,Unknown,Unknown,Unknown,Unknown,19.970342,73.8337
Jupiter Multi-Speciality Hospital,"Tip Top Plaza, 2nd floor, XLO Point, Ambedkar Nagar, MIDC Ambad, Nashik",Unknown,Unknown,422007,Maharastra,Unknown,hospital,Unknown,Unknown,Unknown,Unknown,19.962274,73.734859
Joshi Nursing Home & Ayurved Chikitsa Kendra,"Trambakeshwar Road, Near Papaya Nursery, Ashoknagar, Satpur Colony, Nashik",Unknown,Unknown,422012,Maharastra,Unknown,hospital,Unknown,Unknown,Unknown,Unknown,19.9865319,73.7224982
Suman Hospital,"Jai Bhavani Road, Gandhi Nagar Airport Area, Nashik Road, Nashik",Unknown,Unknown,422101,Maharastra,Unknown,hospital,Unknown,Unknown,Unknown,Unknown,19.9579069,73.8237349
Shree Sai Hospital,"Near Mahadev Mandir, Shramik Nagar, Nashik",Unknown,Unknown,422007,Maharastra,Unknown,hospital,Unknown,Unknown,Unknown,Unknown,19.996016,73.7064476
Shree Swami Samarth Hospital,"Dasak Stop, Jail Road, Nashik Road, Nashik",Unknown,Unknown,422101,Maharastra,Unknown,hospital,Unknown,Unknown,Unknown,Unknown,19.9756586,73.8418277
Dr. Rakesh Tiwari Hospital,"Gulmohar Colony, Anand Nagar, Nashik Road, Nashik",Unknown,Unknown,422214,Maharastra,Unknown,hospital,Unknown,Unknown,Unknown,Unknown,19.9503755,73.8316399
Divya Jyot Hospital,"Anand Nagar, Nashik Road, Nashik",Unknown,Unknown,422214,Maharastra,Unknown,hospital,Unknown,Unknown,Unknown,Unknown,19.9477355,73.8344262
Medicare Multispeciality Hospital,"Gaikwad Complex, Above Jalgaon Peoples Bank, Gaikwad Mala Road, Nashik - Pune Road",Unknown,Unknown,422101,Maharastra,Unknown,hospital,Unknown,Unknown,Unknown,Unknown,19.952837,73.835853
Janki Maternity Home,"Artillery Centre Road, Anand Nagar, Nashik",Unknown,Unknown,422101,Maharastra,Unknown,hospital,Unknown,Unknown,Unknown,Unknown,19.9476983,73.8356664
Gurukrupa Maternity Hospital,"Lingayat Colony, Deolali Gaon, Nashik Road, Nashik",Unknown,Unknown,422214,Maharastra,Unknown,hospital,Unknown,Unknown,Unknown,Unknown,19.9457509,73.8337767
Shree Siddhivinayak Hospital,"Bhagwant Complex, Near Nashik Road, Court, Nashik Road, Opposite to Anuradha Thearter",Unknown,Unknown,422101,Maharastra,Unknown,hospital,Unknown,Unknown,Unknown,Unknown,19.9472146,73.8375857
Nandurkar Hospital,"Laxmi Varsha Apartment, Jail Road, Opp. Vyapari Bank, Nashik",Unknown,Unknown,422101,Maharastra,Unknown,hospital,Unknown,Unknown,Unknown,Unknown,19.9724377,73.8408513
Shaishav Children Hospital,"Ashok Nagar Road, Balwant Nagar, Ashoknagar, Satpur Colony, Nashik",Unknown,Unknown,422012,Maharastra,Unknown,hospital,Unknown,Unknown,Unknown,Unknown,19.9897577,73.7169553
Spandan Hospital,"Tilak Wadi Road, Police Staff Colony, Nashik",Unknown,Unknown,422002,Maharastra,Unknown,hospital,Unknown,Unknown,Unknown,Unknown,19.998867,73.7761976
Ashirwad Nursing Home,"Near Nursing College, Indira Nagar, Wadala - Pathardi Road, Shraddha Vihar, Nashik",Unknown,Unknown,422501,Maharastra,Unknown,hospital,Unknown,Unknown,Unknown,Unknown,19.965107,73.781978
Swami Criticare Hospital,"Near Pelican Park, Vijay Nagar Stop, Cidco, Nashik",Unknown,Unknown,422009,Maharastra,Unknown,hospital,Unknown,Unknown,Unknown,Unknown,19.96795,73.759779
Eshwar Krupa Hospital,"Pavan Nagar Road, Pavan Nagar Road, Shreeram Nagar, Cidco, Nashik",Unknown,Unknown,422010,Maharastra,Unknown,hospital,Unknown,Unknown,Unknown,Unknown,19.9713382,73.754374
Bora Hospital,"Kanifnath Nagar, Kishor Nagar, Nashik",Unknown,Unknown,422009,Maharastra,Unknown,hospital,Unknown,Unknown,Unknown,Unknown,19.9679023,73.7776973
Unique Clinic,"Sheetal Complex, Dwarka-Circal, Nashik - Pune Road, Nashik",Unknown,Unknown,422011,Maharastra,Unknown,clinic,Unknown,Unknown,Unknown,Unknown,19.9919185,73.797839
Optimus Hospital,"Chandak Circle, Tidke Colony, Nashik",Unknown,Unknown,422002,Maharastra,Unknown,hospital,Unknown,Unknown,Unknown,Unknown,19.990491,73.7757129
Nasim Hospital,"Near Dudh Bazar, Old Nashik, Nashik",Unknown,Unknown,422001,Maharastra,Unknown,hospital,Unknown,Unknown,Unknown,Unknown,19.9998084,73.7895939
Suyash Eye Clinic,"Nawale Nagar, Prashant Nagar, Pathardi Phata, Nashik",Unknown,Unknown,422010,Maharastra,Unknown,clinic,Unknown,Unknown,Unknown,Unknown,19.951276,73.759234
Naik Hospital,"Kathe Lane, Near Kathe Galli Road, Dwarka, Nashik",Unknown,Unknown,422011,Maharastra,Unknown,hospital,Unknown,Unknown,Unknown,Unknown,19.989747,73.800939
Vimal Hospital,"Gurudwara Road, Near Sandeep Hotel, Shingada Talav, Mumbai Naka, Nashik",Unknown,Unknown,422011,Maharastra,Unknown,hospital,Unknown,Unknown,Unknown,Unknown,19.9906431,73.7833378
Sonawane Heart Care Hospital,"Mumbai Naka, Matoshree Nagar, Nashik",Unknown,Unknown,422002,Maharastra,Unknown,hospital,Unknown,Unknown,Unknown,Unknown,19.9913697,73.7782432
Dhadiwal Hospital,"Trambakeshwar Road, Opp. New CBS, Matoshree Nagar, Nashik",Unknown,Unknown,422002,Maharastra,Unknown,hospital,Unknown,Unknown,Unknown,Unknown,19.9965967,73.7800892
Shatabdi Super Speciality Hospital,"Suyojit City Center, Opp Mahamarg Bus Stand, Mumbai Naka, Nashik",Unknown,Unknown,422005,Maharastra,Unknown,hospital,Unknown,Unknown,Unknown,Unknown,19.987784,73.783908
Vedant Hospital,"Shri Hari Narayan Kute Marg, Near Mumbai Naka, Matoshree Nagar, Nashik",Unknown,Unknown,422002,Maharastra,Unknown,hospital,Unknown,Unknown,Unknown,Unknown,19.991552,73.779366
Saptashrungi Hospital,"Surya Avenue, Above State Bank of India, Dnyaneshwar Nagar, Pathardi Phata, Nashik",Unknown,Unknown,422010,Maharastra,Unknown,hospital,hospital,Unknown,Unknown,Unknown,19.9553557,73.7629399
Shree Yash Hospital,"Agra Highway, Prasanna Colony, Indira Nagar, Behind Surya Hotel, Nashik",Unknown,Unknown,422009,Maharastra,Unknown,hospital,Unknown,Unknown,Unknown,Unknown,19.9772489,73.7790988
Shraddha Piles Hospital,"First Floor, Jagir Complex, Opposite Maruti Temple, Kath, Nashik",Unknown,Unknown,422011,Maharastra,Unknown,hospital,Unknown,Unknown,Unknown,Unknown,19.9907761,73.7996295
Nelson Memorial Children's Hospital Private Limited,"Near Mahamarg Bus Stand, Next to Tupsakhare Lawns, Mumbai Naka, Tidke Colony, Nashik",Unknown,Unknown,422002,Maharastra,Unknown,hospital,Unknown,Unknown,Unknown,Unknown,19.9883366,73.7775347
Apollo Clinic,"Suyojit Commercial Complex, Mumbai - Agra National Highway, Govind Nagar, Nashik",Unknown,Unknown,422001,Maharastra,Unknown,clinic,Unknown,Unknown,Unknown,Unknown,19.984628,73.782606
Aghor Hospital,"Sheetal Avenue, Rajmata Jijau Marg, Govind Nagar, Nashik",Unknown,Unknown,422009,Maharastra,Unknown,hospital,Unknown,Unknown,Unknown,Unknown,19.981183,73.777323
Sopan Hospital & Neurology Institute,"Behind Sandeep Hotel, Shri Hari Narayan Kute Marg, Tidke Colony, Nashik",Unknown,Unknown,422001,Maharastra,Unknown,hospital,Unknown,Unknown,Unknown,Unknown,19.9913482,73.7790415
Mayara Maternity Hospital,"Sunyan, Behind Tupsakhare Lawn, Mumbai Naka, Tidke Colony, Nashik",Unknown,Unknown,422002,Maharastra,Unknown,hospital,Unknown,Unknown,Unknown,Unknown,19.9881764,73.7786861
