Name,Full Address,Street,City,Postcode,State,Country,Amenity,Healthcare,Phone,Website,Opening Hours,Latitude,Longitude
New Assam Medical,Unknown,AH Road,Unknown,Unknown,Unknown,Unknown,pharmacy,Unknown,Unknown,Unknown,Unknown,26.6265106,92.8002917
"B. K Memorial Hospital, Tezpur",Natunpura,Unknown,Unknown,784001,Assam,Unknown,hospital,Unknown,Unknown,Unknown,Unknown,26.6252346,92.8004099
"PHC, Panchmile","Dolabari-Panchmile Napam Road, Near Borghat Police Post, Chataichapori",Unknown,Unknown,784025,Assam,Unknown,clinic,centre,Unknown,Unknown,Unknown,26.6767445,92.8447804
D K Daimary Clinic,"Mahabhairab, Tezpur",Unknown,Unknown,784501,Assam,Unknown,clinic,Unknown,Unknown,Unknown,Unknown,26.6306712,92.8053836
Global Endosurgery Clinic & Diabetes Care Centre,"Ex Police Line Road, Mahabhairab, Tezpur",Unknown,Unknown,784501,Assam,Unknown,clinic,Unknown,Unknown,Unknown,Unknown,26.6268595,92.8063011
